,start,end,kor,eng
0,7030,8631,"""왕좌의 게임""에 나온거야",It's from
1,8945,10177,어때?,What do you think?
2,10179,12080,잘 모르겠어,I don't know.
3,12082,14816,판타지에 나오는 칼들을 모을거면--,If we're going to start a fantasy sword collection--
4,14818,17819,사실 예전부터 그러고 싶었는데--,and I've long thought we should--
5,17821,20020,이 칼부터 모으는게 맞을까?,is this really the sword to start with?
6,20022,21739,그럼 어떤게 좋은데?,What did you have in mind?
7,21741,26077,"음, 일단 떠오르는 건, 엑스칼리버부터 모아야겠어","Well, off the top of my head, I'd have to go with Excalibur."
8,26079,28863,잉글랜드를 다스릴 힘을 준다잖아.,It gives you the right to rule England.
9,28865,31666,그냥 영화에 나오는  복제품(replica)일 뿐이야.,It would be a replica of a movie prop.
10,31668,33835,그렇네.,Fair enough.
11,33837,37255,그러면 짝퉁(replica) 잉글랜드를  다스릴 힘을 주겠지.,It'd give you the right to rule a replica of England.
12,37257,39557,"근데 여기에 엑스칼리버는 없네,","Well, they don't have an Excalibur here,"
13,39559,41259,어쩌지 그럼?,so what do you want to do?
14,41261,43945,"음, 어려운데.",Mm. Tough decision.
15,43947,46564,"""반지의 제왕""에 나오는 무기는",There's no weaponry from
16,46566,50050,중국산 짝퉁도 안가져다 놨고...,forged in a Chinese sweatshop?
17,50052,53154,"저기 ""빌보 배긴스""의 칼로 하자",Just Bilbo Baggins' sword over there.
18,53156,57742,어른 둘이 호빗 단검을?? 멍청해 보이잖아.,Two grown men with a hobbit's dagger; wouldn't we look silly?
19,59611,60895,"됐어, 이걸로 하자.","Okay, let's go for it."
20,60897,62914,이거 내가 아끼는 건데,"Oh, I see you guys have"
21,62916,64015,멋지지?,found my little treasure.
22,64017,65783,응.,Yeah.
23,65785,67118,그냥 뭐 괜찮네.,"It's okay, I guess."
24,67120,68736,그냥 괜찮다고?? 죽여주는데?,Okay? It's magnificent.
25,68738,70505,쉿쉿쉿쉿,Buh-buh-buh-buh!
26,72341,73908,얼마에 팔거야?,What do you want for it?
27,73910,76177,음 TV 드라마에 나온 물건은,"Oh, it's hard to put a price on something"
28,76179,78830,부르는게 값이긴 한데,that's a copy of something that was on pay cable.
29,79798,82216,너네는 친구니까 250불 어때?,"But for my friends, let's say 250?"
30,82218,84469,야 그건 너무 비싼데,"Oh, that's pretty steep."
31,84471,85536,이거 한정판이야,"Well, it's a limited edition."
32,85538,88773,딱 8천개밖에 없다고,"They only made 8,000 of these bad boys."
33,88775,90224,8천개밖에 없어?,"Only 8,000?"
34,90226,92360,이거 놓치면 안되겠네 얼른 사자,We're wasting precious time. Buy it.
35,92362,94195,기다려봐,Hang on.
36,94197,96263,좀 깎아줄수 없어?,Can you do any better?
37,96265,97565,장난해?,Are you kidding?
38,97567,99317,벌써 가족&친지 할인 해줬잖아,I'm already giving you the friends and family discount.
39,99319,100451,들었어?,"Oh, did you hear that?"
40,100453,101953,가족&친지 할인 해준다잖아,We're getting the friends and family discount.
41,101955,104388,할인 고마워 이걸로 할게,We are honored and we will take it.
42,104390,105606,기다려봐 좀,Slow down.
43,105608,106908,200불?,Two hundred.
44,106910,107909,빨리 좀 하자,What are you doing?
45,107911,109660,250불도 깎아 준거라잖아,250 is already the discounted price.
46,109662,111579,입 좀 닫고 있어봐,Will you shut up?
47,111581,112747,그럼 235불까지는 해줄게,"Tell you what, I'll go 235."
48,112749,114165,에이 그래도 안되겠어,Nope. Maybe another time.
49,114167,116067,야 225불 최대한 깎은거야,"Okay, 225-- my final offer."
50,116069,118753,사자! 사자!,"Take it, take it."
51,118755,120588,200불,Two hundred.
52,120590,122340,아주 날 잡았네 오늘!,"Man, you're killing me!"
53,122342,124725,날을 잡아?  나는 숨도 못쉬겠어 지금,Killing you? I can't breathe.
54,125394,127828,"210불, 손해보고 파는거야","210, and I'm losing money."
55,127830,130681,손해보고 판다잖아 레너드. 미안해,"Oh, now, we can't let him lose money, Leonard. I'm so sorry."
56,130683,133851,210불에 아이언맨 헬멧까지 끼워서,210 and you throw in the Iron Man helmet.
57,133853,135019,제 정신이야?,Are you crazy?
58,135021,136654,Robert Downey Jr. 싸인받은 거라고,That helmet's signed by Robert Downey Jr.
59,136656,137855,근데?,So?
60,137857,139640,야 영화 주인공 싸인도 받은,"Okay, if you're going to question"
61,139642,142210,플라스틱 헬멧의 중요성까지,the importance of an actor's signature on a plastic helmet
62,142212,144111,의심해야 한다면,"from a movie based on a comic book,"
63,144113,147848,우리가 살아있는 거도 의미가 없어!,then all of our lives have no meaning!
64,150869,152420,그래 알았다,"Okay, fine."
65,152422,153754,칼만 해서 210불,"Just the sword, 210."
66,153756,155323,Thank you.,Thank you.
67,155325,156791,이번 주에는 고기먹을 수 있겠다,I can eat meat this week.
68,158710,159710,봤지?,See that?
69,159712,161012,40불이나 아꼈잖아.,I just saved us 40 bucks.
70,161014,163347,내가 예전부터 너 공부는  못한다고 했는데,"I've long said, what you lack in academic knowledge"
71,163349,166050,생활력은 강하네.,you make up for in street smarts.
72,166052,167167,포장해줄까?,You want me to wrap it?
73,167169,168168,아니 됐어,"No, it's okay."
74,168170,170021,이 친구 가슴팍에 꽂아서 가지고 갈래.,I'm gonna stab my friend in the chest.
75,171139,173057,안녕 스튜어트,"Hey, Stuart."
76,173059,174125,아 안녕 윌,"Ah, hey, Wil."
77,174127,177445,잘 있었나 윌 위튼.,"Hello, Wil Wheaton."
78,177447,179363,안녕 쉘든,"Hi, Sheldon."
79,179365,180398,칼 멋지네,Nice sword.
80,180400,182400,나의 소장용 칼 중의 하나지,It's part of my sword collection.
81,182402,184819,넌 소장용 칼 없지? - 없는데,Do you have a sword collection? - No.
82,184821,187738,그럴 줄 알았어.,I'm not surprised.
83,187740,190207,이거 니가 주문한 배트맨 612화,Here's the Batman 612
84,190209,192710,Jim Lee 특별커버판이야,with the Jim Lee alternate cover that you wanted.
85,192712,194579,"멋지네, 얼마 주면 되지?",Awesome. What do I owe you?
86,194581,195379,40불.,40 bucks.
87,195381,196414,가격도 좋네.,Good deal.
88,196416,197715,병신.,Sucker.
89,197717,200251,가족&친지 할인되는지  물어보지도 않았어.,Didn't even ask for the friends and family discount.
90,200253,202053,"야 금요일에 우리 집에서 파티하는데,","Hey, I'm having a party at my house on Friday,"
91,202055,203537,너두 와.,and I was hoping you would stop by.
92,203539,204805,여자들도 오지?,Will there be girls there?
93,204807,205756,그럼 당연하지,"Yeah, of course."
94,205758,209093,저번에는 없길래...,'Cause there wasn't last time.
95,209095,212063,여자들도 올거야.,There will be girls.
96,212065,214765,너네들도 오고 싶으면 와도 돼,You guys are invited if you want to come by.
97,214767,216383,Thank you.,Thank you.
98,216385,217384,"All right, great.","All right, great."
99,217386,218903,다음에 보자,Later.
100,220772,222556,네 속셈을 알겠다,I see what you're doing.
101,222558,224241,내 숙적이 여는 파티에,You accept an invitation
102,224243,226460,간다고 해놓고,"to a party at the home of my sworn enemy,"
103,226462,228195,걔가 우리도 온다고 얘기했는데,"he tells everyone we're going to be there,"
104,228197,230064,우리가 안오면 쟤는 쪽팔리겠지,"and when we don't show, he looks the fool."
105,230066,231449,구밀복검이네.,Fiendishly clever.
106,232951,234619,나는 진짜로 갈건데.,I was actually thinking about going.
107,234621,237838,가서는 파티 별로라고 하면서,And then declaring the party a fiasco
108,237840,239674,나오려고 하지? 그럼 쟤는,"and storming out, leaving him humiliated"
109,239676,241092,손님들 앞에서 쪽팔리고.,in front of his guests.
110,241094,243060,괜찮은데.,Love it.
111,243062,246998,아니 라지랑 하워드 데리고 가서 잘 놀다 올건데.,"No, I was gonna grab Raj and Howard and have a good time."
112,247933,249884,오 잘됐네 남자들만 더오고,"Oh, great, more guys."
113,249886,253354,윌 위튼의 남탕파티 시즌2 겠네...,It's gonna be another Wil Wheaton sausage-fest.
114,254422,258025,"♪ Our whole universe was in a hot, dense state ♪","♪ Our whole universe was in a hot, dense state ♪"
115,258027,261362,♪ Then nearly 14 billion years ago expansion started... Wait! ♪,♪ Then nearly 14 billion years ago expansion started... Wait! ♪
116,261364,262980,♪ The Earth began to cool ♪,♪ The Earth began to cool ♪
117,262982,265516,"♪ The autotrophs began to drool, Neanderthals developed tools ♪","♪ The autotrophs began to drool, Neanderthals developed tools ♪"
118,265518,268202,♪ We built the Wall ♪  ♪,♪ We built the Wall ♪ ♪   ♪
119,268204,270855,"♪ Math, Science, History, unraveling the mystery ♪","♪ Math, Science, History, unraveling the mystery ♪"
120,270857,272773,♪ That all started with a big bang ♪,♪ That all started with a big bang ♪
121,272775,273925,♪   ♪,♪   ♪
122,273926,276426,"Original Air Date on October 13, 2011","Original Air Date on October 13, 2011"
123,276427,279052,"== sync, corrected by  dk2039@naver.com","== sync, corrected by   =="
124,279054,281366,쉘든 물 좀 갖다 줄래?,"Sheldon, can you grab me a water?"
125,281367,282949,그러던지,Possibly.
126,282951,284560,준다는 거야 안 준다는 거야?,Can you or can't you?
127,284561,286194,그렇게 간단한 문제가 아냐 레너드.,"It's not that simple, Leonard."
128,286196,288780,그냥 넘어가는 법이 없네 그지?,"It never is, is it?"
129,288782,289948,SHELDON: 지금 시점에,"SHELDON: At this moment,"
130,289950,292067,우리의 관계는 상호 모순적인,our relationship exists
131,292069,294236,2가지 상태에 있어.,in two mutually contradictory states.
132,294238,298657,"네가 윌 위튼의 파티에 가거나 혹은 안가기 전 까지,","Until you either do not go or go to Wil Wheaton's party,"
133,298659,302077,너는 내 친구이면서 동시에 친구가 아니야.,you are simultaneously my friend and not my friend.
134,303546,305163,지금 이 상태를 말하자면,I'm characterizing this phenomenon
135,305165,308300,"""슈뢰딩거의 우정""이라고 할까.",as Schrodinger's Friendship.
136,308302,311136,알았어 이제 물 좀 줄래?,Got it. Can I have my water?
137,311138,312421,당연하지,Of course.
138,312423,314706,니가 가져다 먹어 이 배신자야.,"Now get it yourself, you traitor."
139,316542,319761,대체 무슨 일이야?,"Wait, what is going on?"
140,319763,321146,니가 잊어버렸을까봐 말해줄게,"In case you have forgotten,"
141,321148,322714,"""슈뢰딩거의 고양이""는  사고 실험으로서.....",Schrodinger's cat is a thought experiment...
142,322716,324215,아냐 아냐 안 까먹었어,"No, no, I didn't forget."
143,324217,327152,음 박스 안에 고양이가 있는데 열어보기 전 까지는,"Um, there's this cat in a box and until you open it,"
144,327154,328987,죽었을 수도 있고 살았을 수도 있다.,it's either dead or alive or both.
145,329906,331573,근데 네브라스카에서는 고양이가,"Although, back in Nebraska, our cat got stuck"
146,331575,334242,캠핑용 박스에 갇히면 열어볼 필요가 없어,"in my brother's camp trunk, and we did not need to open it"
147,334244,336862,그 안에 죽은 고양이가 종류별로 다 있거든,to know there was all kinds of dead cat in there.
148,338031,339898,소박한 이야기에서 물리학 지식까지,"Homespun stories, knowledge of physics"
149,339900,341249,그리고 안 똑똑해 보이는 가슴까지,and a bosom that defies it.
150,341251,343201,너 진짜 다 갖췄다 그지?,"You're the whole package, aren't you?"
151,345171,347039,늦어서 미안해,Sorry I'm late.
152,347041,348840,좋은 소식이 있어,"Uh, I got great news."
153,348842,350959,이번 봄에 우주 정거장에서 쓸,NASA picked my team's design
154,350961,353578,딥필드 우주 망원경 디자인을 뽑는데,for the deep field space telescope that's going on
155,353580,355297,NASA에서 우리 팀을 뽑았어!,the International Space Station this spring.
156,355299,357132,(all murmur excitedly),(all murmur excitedly)
157,357134,358734,정말 잘됐다 하워드!,"Howie, that's wonderful!"
158,358736,359735,축하해!,Congratulations!
159,359737,360936,좋은 소식 또 있어.,It gets better.
160,360938,363105,망원경 가지고 우주에 갈 때,Someone has to go up with the telescope
161,363107,367859,외부 전문가가 따라가는데 그게 누굴까????,"as a payload specialist, and guess who that someone is."
162,367861,370462,Muhammad Li.,Muhammad Li.
163,371263,373598,Muhammad Li가 누군데?,Who's Muhammad Li?
164,373600,376401,Muhammad는 세계에서 제일 많은 이름이고,"Muhammad is the most common first name in the world,"
165,376403,378036,Li는 제일 많은 성이야,"Li, the most common surname."
166,378038,379538,답을 잘 모르겠어서,"As I didn't know the answer,"
167,379540,381873,수학적 확률이 높은 걸로 찍었지,I thought that gave me a mathematical edge.
168,381875,384109,바로 난데 쉘든,"It's me, Sheldon."
169,384111,385010,나라고,It's me.
170,385012,386444,내가 바로 우주에 가게 됐어!,I'm going up in space!
171,386446,388613,말하자면 이제 나는 우주비행사야!,"Technically, I'm an astronaut."
172,388615,390499,(all murmur excitedly) 정말 놀랍다!,(all murmur excitedly) That's amazing!
173,390501,392117,(chuckles) 잠시만,(chuckles) Hang on a second.
174,392119,394002,NASA에는 이제 우주왕복선이 없다던데,NASA doesn't have a shuttle anymore.
175,394004,395954,우주에는 어떻게 가는거야?,How are you going to get up there?
176,395956,397089,아주 좋은 방법이 있어.,"Oh, well, it's really cool."
177,397091,399141,모스크바에 가면  나를 카자흐스탄에 데려가는데,"You fly to Moscow, they take you out to Kazakhstan,"
178,399143,401977,거기서 러시아 소유즈 로켓을 타고,and then you get into a Russian Soyuz rocket which shoots you
179,401979,403311,저궤도위성까지 가는거지,into a low earth orbit.
180,403313,405931,카자스흐탄 마피아가 로켓연료를 암시장에 팔아넘기면,Or just sits there on the launch pad because the Kazakhi mafia
181,405933,408016,발사대에 앉아만 있다가 오는거고,sold the rocket fuel on the black market.
182,410103,412270,러시아 로켓은 안전해?,Are those Russian rockets safe?
183,412272,414689,음 체르노빌을 만든 착한 애들이,"Well, I mean, safe as it can be when it was built"
184,414691,416858,만들었으니 완전 안전하겠지?,by the good folks who brought you Chernobyl.
185,418745,421146,건배라도 해야겠다,I'd like to propose a toast.
186,421148,423815,우주에 가는 것은 우리 모두의 꿈이었는데,"The dream to go up into space is one we all share,"
187,423817,426084,하워드가 그걸 실현시켰어,and Howard's making that a reality.
188,426086,427536,네가 자랑스러워,We're all very proud of you.
189,427538,429004,ALL: 건배,ALL: Cheers.
190,430489,431706,정말 기분좋은 건배였어,That was a lovely toast.
191,431708,433008,잘했어 -Thank you.,Kudos. Thank you.
192,433010,434960,"동시에, 신물나는 건배라니","Simultaneously, a festival of cloying cliches."
193,434962,437012,너 정말 별로다,You sicken me.
194,444720,446188,오늘 말이 없네.,You're really quiet.
195,446190,447839,기분 안 좋아?,Is everything okay?
196,447841,449891,괜찮아,Fine.
197,452195,454613,그냥 좀 피곤하네,Just a little tired.
198,454615,456848,너무 피곤하면 안되는데,"I hope not too tired, because I'm feeling"
199,456850,459184,오늘따라 힘이 불끈불끈하거든,particularly masculine right now.
200,460403,463354,합체준비 완료! 무슨 말인지 알지?,"All systems go, if you catch my drift."
201,463356,466958,무슨 말인지는 알지,I always catch your drift.
202,466960,469795,기분 안 좋은거 맞네,"All right, well, something's obviously bugging you."
203,469797,470996,왜 그래?,What is it?
204,470998,473048,어떻게 나랑 상의도 없이,I just can't believe you signed up
205,473050,475300,우주에 가기로 결정할 수 있어?,for the space program without even talking to me.
206,475302,478336,아 무슨 말인지 알겠다,"Oh, I get it."
207,478338,480639,나 걱정돼서 그러는 구나,You're worried about me.
208,480641,482424,고마워 자기야,That is so sweet.
209,482426,487979,들어봐 NASA에는 이런 말이 있어,"You know, there's a saying we have at NASA."
210,490149,493218,"""모로 가도 집에만 가면 된다""",What makes the right stuff so right
211,493220,496271,(의역),is that it always comes home.
212,497773,500075,그냥 말 하지마 하워드.,"Just stop talking, Howard."
213,501911,503495,내가 우주비행사가 된다고 했을 때,This isn't the reaction I expected
214,503497,505897,이런 반응 기대한 건 아니었는데,when I told you I was gonna be an astronaut.
215,505899,508283,그럼 내가 어떡할 줄 알았는데?,What did you think was going to happen?
216,508285,510452,솔직히 말해? 섹스,Honestly? Sex.
217,512288,513905,하워드,Howard.
218,513907,515924,이거 정말로 대단한 일이야,Do you realize what a big deal this is?
219,515926,519678,우주비행사로 뽑히는 게 얼마나 큰 영광인데,What an honor it is to be chosen to go into space?
220,519680,521079,그래 알았어,"Yeah, I get it."
221,521081,523381,내 말은 결정할 때 나랑도  얘기해야 한다는 거지,I just wish you included me in the decision.
222,523383,525416,우리는 부부가 될 거잖아,We're supposed to be partners.
223,525418,527352,우리는 팀이라구,We're supposed to be a team.
224,529222,531139,미안해 자기 말이 맞네,I'm sorry. You're right.
225,531141,534693,그럼 다시 말해볼게,"Okay, let's try this again."
226,534695,538363,"베르나데트, 우리 둘 모두에 관련된 얘기가 있는데","Bernadette, an opportunity has come up"
227,538365,543318,그 얘기 했으면 좋겠어,"that impacts both of us, and I'd like to discuss it."
228,544820,546604,그래,Okay.
229,546606,549107,국제우주정거장에 3주동안 가 있을,I've been offered a chance to go up
230,549109,553111,기회가 생겼어,to the International Space Station for three weeks.
231,553113,554963,어떻게 생각해?,What are your thoughts on that?
232,554965,558049,음 먼저 결정할 때,"Well, first of all, thank you"
233,558051,560919,내 생각도 해줘서 고마워,for including me in the decision-making process.
234,560921,563305,우리는 팀인데 뭘,"Hey, we're a team."
235,563307,564306,(chuckles),(chuckles)
236,564308,565840,그래서 어떻게 생각해?,"So, what do you think?"
237,565842,567642,안 돼,No.
238,568477,569728,안 된다고?,No?
239,569730,571513,안 돼,No.
240,571515,574733,왜 안되는데?,Why not?
241,576485,579654,"하워드, 우리 아버지는 경찰이셨는데","Howard, my father was a police officer."
242,579656,581806,매일 나가실 때마다 다음 날에,We never knew from one night to the next
243,581808,583742,아버지가 살아서 돌아오실지조차 확실하지 않았어,if he was going to come home alive.
244,583744,585160,정말 끔찍했다구.,It was horrible.
245,585162,588246,그래서 자기랑도 그런 식으로  살고 싶진 않아,And I don't want to live that way with you.
246,590866,597172,우리 아버지는 내가 11살 때 집을 나가셨어,"Hey, my father abandoned me and my mother when I was 11."
247,597174,599424,그리고는 한번도 다시 보지 못했어,We never saw him again.
248,599426,601826,아 떽 우주는 안 된다니까!,"Oh, boo-hoo, you're not going to space!"
249,606665,609634,하워드 정말 잘 됐다 그지?,"Pretty cool about Howard, huh?"
250,609636,611770,우리 사이 괜찮은 것처럼 얘기하지마.,Don't talk to me as if nothing's happened between us.
251,611772,613188,그리고 응 진짜 잘됐다.,"And yes, it sure is, buddy."
252,616142,618727,미치겠네 슈뢰딩거 그거좀  그만하면 안될까?,"For God's sake, will you stop with the Schrodinger stuff."
253,618729,620946,그러면 더 간단한,Would you prefer a simpler application
254,620948,622397,Heisenberg의 불확정성이론을 적용해 볼까?,"of Heisenberg's uncertainty principle,"
255,622399,623448,네가 어디에 있는지 혹은,in which I could either
256,623450,625700,내가 널 좋아하는 지는 알 수 있지만,"know where you are or whether I like you,"
257,625702,627352,둘다 동시에 알 수는 없는 그런거?,but not both?
258,627354,630555,진짜 끝이 없네 정말,"You never stop talking, do you?"
259,632024,633708,이해가 잘 안 돼,I don't understand.
260,633710,634826,레너드가 윌 위튼 파티에 가든 말든,What differences does it make
261,634828,636361,무슨 차이가 있어?,if Leonard goes to Wil Wheaton's party?
262,636363,638747,윌 위튼은 쉘든의 불구대천지원수야,Wil Wheaton is Sheldon's mortal enemy.
263,638749,639914,불구대천지원수?,Mortal enemy?
264,639916,641716,"쉘든, 네가 비현실적으로","Mm-hmm. Sheldon, I know you're a bit"
265,641718,643251,괴짜라는 건 알지만...,"of a left-handed monkey wrench, but..."
266,643253,647038,진짜 그 정도의 적(enemy)이 있어?,you really have a mortal enemy?
267,647040,649391,정확히 말하면 61명이 있지,"In fact, I have 61 of them."
268,650226,652177,61명 목록 한번 볼래?,Would you like to see the list?
269,652179,654145,"Oh, 아니라고 말 해 아니라고 말 해.","Oh, say no, say no, say no, say no."
270,654147,655914,너 목록에서 지워진지 얼마 안 됐거든,You just got off the list.
271,655916,657816,다시 올라가고 싶어?,Would you like back on it?
272,658651,661052,잠시만 기다려봐.,This'll just take a moment.
273,661054,664322,5.25인치 디스켓에 있어.,It's on a five and a quarter inch floppy.
274,670363,671579,디스켓?,A floppy disk?
275,671581,675166,아홉 살 때부터 목록을 만들었거든.,"Well, I started the list when I was nine."
276,675168,677402,윌 위튼은 어쩌다 거기 올라간거야?,How did Wil Wheaton get on the list?
277,677404,678920,아 제발! - 안돼!,"Oh! Oh, God! - Oh! Come on!"
278,678922,682257,"어렸을 때 난 ""스타트렉""에서","As a child, I loved Wesley Crusher,"
279,682259,684342,윌 위튼의 캐릭터 Wesley Crusher를 좋아했지,Wil Wheaton's character on
280,684344,688079,그래서 몇 시간이나 버스를 타고,"So, I drove for hours by bus to a   convention"
281,688081,690181,"윌 위튼이 나오는 ""스타트렉"" 박람회에 갔어","at which Wil Wheaton was scheduled to appear,"
282,690183,693084,Wesley Crusher 액션 피겨에 싸인받고 싶었거든,so that I could get my Wesley Crusher action figure signed.
283,693086,695020,그렇지만 그는 나타나지 않았어,"But he never showed, because"
284,695022,697138,분명히 그는 Hollywood 광장의,"apparently, it was cooler for him"
285,697140,700241,왼쪽 아래 모퉁이에 있는 게 더 좋았나 보지,to be the lower-left corner on
286,702528,703611,아 이런!,"Oh, damn!"
287,703613,705130,디스켓이 고장났어,The floppy failed.
288,705132,706231,흠,"Well,"
289,706233,708266,1989년에 Verbatim Corporation에서,whoever was in charge of quality control
290,708268,710652,품질관리를 맡으신 바로 당신,"at the Verbatim Corporation in 1989,"
291,710654,713872,축하합니다 방금 리스트에 올라가셨네요,"congratulations, you just made the list."
292,717293,719310,하워드?,Howard?
293,719312,721496,지금은 하고 싶어?,Change your mind about sex?
294,721498,725283,아직 화났어도 난 할건데.,"I'm still mad, but I'll do it."
295,725285,727786,아니 생각 좀 해봤어.,"No, I've just been thinking."
296,729055,731456,내가 자기 걱정되는건 중요한게 아닌거 같아,It doesn't matter if I'm afraid for your safety.
297,731458,733291,자기 꿈을 가로막는,I don't want to be the person
298,733293,735310,그런 사람이 되고 싶진 않아,who stands between you and your dreams.
299,735312,736761,정말?,Really?
300,736763,738179,정말,Really.
301,738181,740315,우주에 가는게 그렇게 의미가 크다면,"If going into space means that much to you,"
302,740317,742183,그 얘기는 이제 더 이상 안할게,I will never say another word about it.
303,742185,743768,고마워,Thank you.
304,743770,745320,사랑해,I love you.
305,745322,747305,나도 사랑해,"I love you, too."
306,750576,752527,그럼 지금 할까?,"So, sex now?"
307,752529,754162,그래,Okay.
308,754164,756030,양치하는 걸 깜빡했어,I just forgot to brush my teeth.
309,756032,758199,금방하고 올게,I'll be right back.
310,760369,762587,(rhythm and blues playing),(rhythm and blues playing)
311,764490,767658,"♪ Oh, baby ♪","♪ Oh, baby ♪"
312,773933,776468,♪ I'm ♪,♪ I'm ♪
313,776470,778937,♪ I'm not in love with you... ♪,♪ I'm not in love with you... ♪
314,778939,783191,MRS. WOLOWITZ: 내가 죽기 전엔 우주 못 가!,MRS. WOLOWITZ: Over my dead body my son goes into outer space!
315,786562,789063,준비 다 됐어,I'm ready.
