,start,end,kor,eng
316,1015048,1016547,어디 가는데?,"Whoa, whoa, where are we going?"
317,1016549,1018182,너네 집에 그림을 걸어야지,We're going to go put this painting back up
318,1018184,1019684,베르나데트는 어쩌고?,"in your apartment. Well, what about Bernadette?"
319,1019686,1022420,같이 놀아주는 것으로  만족하라고 해,"Oh, screw her. She's just lucky we let her hang out with us."
320,1045644,1046844,뭐하는 거야?,What are you doing?
321,1046846,1049313,온도를 높이려고,I'm trying to raise the temperature in here
322,1049315,1051582,젖꼭지가 옷을 뚫고 나오기 전에,before my nipples tear through my shirt.
323,1052751,1055619,서모스탯을 쓰면 안돼?,Why don't you just turn up the thermostat?
324,1055621,1057154,좋은 질문이야,Aha! Good question.
325,1057156,1059690,서모스탯이 옆방에 있을  거라고 누가 생각했겠어,It turns out the thermostat for my new office
326,1062362,1064228,대번포트 교수님 사무실인데,"in Professor Davenport's office,"
327,1064230,1065963,갱년기 발한을 즐기고 있어,who is currently enjoying the hot flashes
328,1068667,1070835,여긴 왜 구멍이 있어?,Why is there a hole here?
329,1070837,1072837,사무실에 왜 구멍이 있냐고?,Why is there a hole in my new office?
330,1072839,1075139,두 가지로 추려봤어,I've narrowed it down to two possibilities:
331,1075141,1076907,누군가가 벽 안에 있던 뭔가를 갖고 싶어했 거나,"""There was something in the wall"
332,1079379,1080611,더 소름끼치는 이유는,"or the more disturbing,"
333,1080613,1083881,벽 속의 무언가가 나가고 싶었다는 거지,"""there was something in the wall that wanted out."""
334,1085283,1087685,그래도 창문이  열리는 방이잖아,"Well, at least you finally got a window that opens."
335,1087687,1088619,좋네,That's nice.
336,1088621,1090988,그래? 들어봐,Is it? Listen.
337,1092091,1093257,풍경 소리 싫어해?,"What, you don't like wind chimes?"
338,1093259,1095493,"질색이지, 그게 다가 아냐","No, I hate them, but it gets worse."
339,1098731,1101365,바로 저거야 - 새 소리?,There it is. - The bird?
340,1101367,1104101,불협화음이야,It's completely out of tune with the wind chimes.
341,1105003,1105970,그래서?,So?
342,1105972,1107204,아직도 모르겠어?,"You don't get it, do you?"
343,1107206,1108672,저건 흉내지빠귀야,That's a mockingbird.
344,1108674,1110741,흉내지빠귀는  소리를 바꿀 수 있어,"Mockingbirds can change their song,"
345,1110743,1112643,일부러 저러고 있어,which means he's out of tune on purpose.
346,1114080,1115679,날 놀리고 있어,He's mocking me.
347,1116783,1119083,"저런, 너네도 느껴져?",Oh dear. There it is again. Do you feel it?
348,1119085,1123154,네가 정신 나간  놈이란걸 깨닫고 있냐고?,The growing realization that you are one wacky bastard? Yep.
349,1123156,1125489,"아니, 진동 말이야",No. The vibration.
350,1125491,1127491,지질학 실험실 바로 밑이야,"We are directly underneath the geology lab,"
351,1127493,1130094,체 진동기를 또 켰나봐,and they're running their confounded sieve shakers again.
352,1130096,1131395,"야, 자갈 원숭이들아","Hey, gravel monkeys,"
353,1131397,1134698,돌대가리를 흔들어도 충분한 진동이 느껴진다고,"if you need to shake rocks, try jiggling your heads around!"
354,1134700,1137001,"쉘든, 진정해","Sheldon, relax."
355,1137003,1138068,어떻게?,How can I relax?
356,1138070,1139937,신경이 너무 날카로워졌어,My nervous system is being stretched out
357,1139939,1143207,구멍에 새 소리에,like the strings of a harp and plucked by holes and birds
358,1143209,1145776,로스만 교수님은 내쫓기 어려워,and wind and the low-hanging scrotum
359,1150115,1151282,그렇게 불만이면,"If you're not happy,"
360,1151284,1152917,크립키한테 넘겨주면 어때?,why don't you just let Kripke have the office?
361,1152919,1154285,그럼 내가 지는 거잖아,"Wait, and let him win?"
362,1154287,1156287,내가 미쳤냐?,Do I look crazy to you?
363,1156289,1157655,시끄러워서 생각을 못 하겠다고,"(rumbling) We're trying to think down here,"
364,1157657,1160307,정동에 미친 광석쟁이들아!,you geode-loving feldspar jockeys!
365,1160309,1161942,그리고 너,(mockingbird whistles) And you...
366,1161944,1164495,"정확한 음은 C, D, E, G, A야","the notes are C, D, E, G and A."
367,1164497,1167264,또 틀리면 나무를 베어버릴 거야,You pick one or I am chopping down that tree!
368,1177671,1179182,어때?,How's that?
369,1179183,1181967,오른쪽을 더 높게,Little higher on the right.
370,1181969,1183886,지금은? - 조금 더,Now? - Little more.
371,1183888,1185971,이제 됐다,No. That's got it.
372,1187891,1190476,그러네,"Yeah, okay. That's, uh, that's good."
373,1191394,1192834,비밀을 말해줄게,I'll let you in on a little secret.
374,1193981,1196866,처음에는 누드로 그려줬어,Originally we were painted nude.
375,1202806,1205774,그런 다음에 옷을 그려넣었어,"But I had him add clothes, 'cause I thought"
376,1205776,1208961,이성애적 관계에 괜한 소문을 내고 싶지 않아서,it was an unnecessary challenge to our heterosexuality.
377,1211248,1213716,잘했어,"Yeah, good call."
378,1213718,1216001,혹시라도 네 생각이 바뀌면,"But if you ever change your mind, all it would take"
379,1216003,1219054,비눗물이랑  스폰지만 있으면 돼,"is some warm, soapy water and a couple of sponges."
380,1220073,1221376,그림 얘기를 하는 거지?,"You're talking about the painting, right?"
381,1221401,1222601,그렇지,Sure.
382,1228231,1230933,사람 살려,SHELDON: Help! Somebody help!
383,1234404,1235754,무슨 일이야?,What happened?
384,1235756,1239508,뭐가 있는지 보려고 했는데 머리가 안 빠져,I was trying to see what was in here and my head got stuck.
385,1239510,1241643,그런 짓은 왜 했어?,Why would you do that?
386,1241645,1244446,과학적 호기심이라고,It's called scientific curiosity!
387,1245699,1247733,버터나 갖고 와,Now go get butter.
388,1247735,1249151,기다려,Hang in there.
389,1249153,1250953,금방 올게,I'll be right back.
390,1252255,1312255,http://tbbt.tistory.com,"== sync, corrected by   =="
