,start,end,kor,eng
326,1048745,1051446,터프한 척 하니까 좀 귀엽네,Wow. You are cute when you get all gangsta.
327,1063793,1066160,나 총상 입었어,"So, I've got a gunshot wound."
328,1067546,1070181,좀 멋지지?,That's pretty bad-ass.
329,1070183,1072851,리복 운동화가 총상을 입고,"No, you've got a Reebok with a gunshot wound"
330,1072853,1074853,넌 새끼 발가락이 조금 까진 것 뿐이야,and an ouchie on your pinkie toe.
331,1076857,1078974,"이봐, 난 반창고도 붙였어",Hello? They gave me a Band-Aid.
332,1078976,1080341,병원에서는 아무때나 반창고를 붙여주지 않아,Hospitals do not issue Band-Aids
333,1081895,1083211,그게 법이야,That is the law.
334,1085515,1088450,오늘 정말 즐거웠어,"Well, thank you for a really cool evening."
335,1088452,1090518,응급실에서 스타워즈 양말 숨겨줘서 고마워,Thank you for hiding my   socks
336,1094357,1097325,베타 테스트가  어땠는지 평가해볼까?,Is it a good time to evaluate the beta test
337,1098912,1101413,괜찮아 보이네,Things are looking good.
338,1101415,1103131,아직도 천천히 나가는 거야?,"So, are we still taking things slow?"
339,1103133,1104499,오늘은 총상을 입고,"Because a gunshot wound today,"
340,1104501,1107252,지난 주에는  서랍에 엄지가 끼었어,"and last week, I slammed my thumb in the kitchen drawer."
341,1107254,1109454,난 시간이  얼마 안 남았어,We don't know how much time I have.
342,1110339,1112206,잘자,"Good night, you."
343,1128357,1130892,"구텐탁, 유튜브",YouTube.
344,1130894,1133895,전 바이에른 사람입니다,
345,1133897,1136231,저는 프레첼이에요,
346,1138000,1140368,쉘든 쿠퍼와 함께,Sheldon Cooper Presents: Fun...
347,1140370,1141786,깃발 공부를 합시다,Mit... Flags.
348,1141788,1145788,http://tbbt.tistory.com,"== sync, corrected by   =="
349,1152379,1153996,왼쪽 첫번 째 문입니다,First door on the left.
350,1153998,1156165,감사합니다,Thank you.
351,1162422,1166509,"데이브, 청소기 수리점 6개를 찾았습니다","Dave, I found six vacuum cleaner repair shops in your area."
352,1166511,1169011,그 중 4개가 근처에 있습니다,Four are fairly close to you.
353,1172282,1173966,"안녕, 섹시","Hello, sexy."
354,1173968,1176469,어떻게 도와드릴까요?,What can I help you with?
355,1184761,1187580,사랑을 나누고 싶다면 말만 하세요,"If you'd like to make love to me, just tell me."
356,1193238,1196038,"죄송합니다, 무슨 말인지...",I'm sorry. I don't understand...
357,1199593,1259593,안돼!,No!
